{
  "$schema": "../../../schemas/workflow.schema.json",
  "schemaVersion": "1.0.0",
  "jobId": "job",
  "mode": "review",
  "coverReviewDecision": "pending",
  "roughCutReviewDecision": "pending",
  "visualArrangementReviewRequired": true,
  "visualArrangementReviewDecision": "pending",
  "roughCutSelectionPolicy": "reference-aligned-last-complete-take-v1",
  "roughCutSelectionPolicyOrigin": "reference-aligned-last-complete-take-v1",
  "roughCutSelectionFallbackWaiver": null,
  "captionMode": "subtitles",
  "captionModeSource": "default",
  "captionModeAcknowledged": false,
  "visualAxisMode": "a-axis-overlay",
  "visualAxisModeSource": "default",
  "visualAxisModeAcknowledged": false,
  "referenceScriptStatus": "none",
  "referenceScriptAcknowledged": false,
  "referenceScriptPath": null,
  "referenceScriptSha256": null,
  "reconciliationReturnState": null,
  "creativeConfirmationSha256": null,
  "creativeDocumentFingerprints": null,
  "authoritativeMediaPath": null,
  "authoritativeMediaSha256": null,
  "sourceTranscriptSha256": null,
  "trimPlanSha256": null,
  "visualPlanSha256": null,
  "compositionArtifactPath": null,
  "compositionArtifactSha256": null,
  "lastKnownGoodDelivery": null,
  "revisionId": 1,
  "currentState": "intake",
  "pendingGate": null,
  "completed": false,
  "createdAt": null,
  "updatedAt": null,
  "gates": {
    "rough-cut-review": { "status": "not-reached" },
    "visual-arrangement-review": { "status": "not-reached" }
  },
  "history": []
}
